{
  "$schema": "https://json-schema.org/draft/2020-12/schema",
  "$id": "https://mandipulse.local/schemas/web-export/v1/mandis.schema.json",
  "title": "Mandi metadata export",
  "type": "array",
  "minItems": 1,
  "items": {
    "type": "object",
    "additionalProperties": false,
    "required": [
      "market_id",
      "mandi_id",
      "market_name",
      "district_name",
      "latitude",
      "longitude",
      "active_days"
    ],
    "properties": {
      "market_id": { "type": "integer" },
      "mandi_id": { "type": "string", "minLength": 1 },
      "market_name": { "type": "string", "minLength": 1 },
      "district_name": { "type": "string" },
      "latitude": { "type": "number", "minimum": -90, "maximum": 90 },
      "longitude": { "type": "number", "minimum": -180, "maximum": 180 },
      "active_days": { "type": "integer", "minimum": 0 }
    }
  }
}
